"displayUrl","caption","ownerFullName","ownerUsername","url","commentsCount","firstComment","likesCount","timestamp","queryTag"
"https://scontent-lga3-2.cdninstagram.com/v/t51.2885-15/628041327_18527673256070113_7851217890168085585_n.jpg?stp=dst-jpg_e15_tt6&_nc_ht=scontent-lga3-2.cdninstagram.com&_nc_cat=101&_nc_oc=Q6cZ2QEUjp_D7PdFzkyusAN-sy_10jyS9p00SLU8klZJCnWkBY2NxSZn-wz9FXuOC-omhmU&_nc_ohc=NkIWsCO4VtYQ7kNvwGuGD4S&_nc_gid=p1oQ49_zglilFapi_ntJiA&edm=APs17CUBAAAA&ccb=7-5&oh=00_AftQa0EgfqDN2bRoqJGW9xUgMj1ohW-d3LGo8LiETuSeaw&oe=699E8B3C&_nc_sid=10d13b","El ruido sí importa: afecta la salud, el descanso y la vida en comunidad. 

He estado con quienes lo viven. La ley ya existe y la propuesta también; ahora falta hacerla cumplir y acompañar su seguimiento. Quiero estar ahí para hacerlo contigo.🫂🤝🏻

Mira la cara de Galán y marca 111 a la Cámara por el Nuevo Liberalismo. ❤️

#Camideambiente #LeyContraelRuido","Camilo Quintero Giraldo","camideambiente","https://www.instagram.com/p/DUZYpkfiaSs/","19","Quien controla a los vendedores ambulantes con sus parlantes a todo volumen a toda hora por tod medellín","168","2026-02-06T00:39:56.000Z",
"https://instagram.fcps3-1.fna.fbcdn.net/v/t51.2885-15/629539800_1094684972835021_6382558835024925289_n.jpg?stp=dst-jpg_e15_tt6&_nc_ht=instagram.fcps3-1.fna.fbcdn.net&_nc_cat=109&_nc_oc=Q6cZ2QEKop2RdJCFoAAhtuCwPUn8VLG3198ZkajyHlag7Ew-xTnXKmjGm2nlGkOviI6-uTndm9lBn7OLw-QjbmBOqJ0E&_nc_ohc=_ZU4QTVqmMkQ7kNvwERt_yU&_nc_gid=yrybQMtUJxt6rCDElVuFlw&edm=APs17CUBAAAA&ccb=7-5&oh=00_AfsM4-V7CGGfr2b3j-xfQ0WJ9aSxLn--0_MAxzGL4i-RiQ&oe=699E776B&_nc_sid=10d13b","Yo no pedí ser el galán de la Ley Contra el Ruido…
pero alguien tenía que serlo. 😌🔇

Si el ruido también te tiene cansado,
vota 111 y hagámosla cumplir. ✋🗳️

#LeyContraElRuido #Camideambiente #Convivencia #Antioquia","Camilo Quintero Giraldo","camideambiente","https://www.instagram.com/p/DUdm-g5jgbd/","5","La ley contra el ruido es pertinente y está perfecta, pero no la aplican en muchas partes. Las denuncias son ignoradas por la policía o las personas ignoran a la policía. Pueden hacer el intento en partes distintas y medir su impacto","161","2026-02-07T16:01:46.000Z",
"https://scontent-sea1-1.cdninstagram.com/v/t51.2885-15/629208084_18529008253070113_8588451112281705834_n.jpg?stp=dst-jpg_e15_fr_p1080x1080_tt6&_nc_ht=scontent-sea1-1.cdninstagram.com&_nc_cat=101&_nc_oc=Q6cZ2QHVqcdyQmE5jKAYfQ4Cv5dF5bIJwKXgglvEXICrKVJbBHKAq9t29GaAUSgbr3-w0sI&_nc_ohc=CY00FyNRAucQ7kNvwF6Mf9O&_nc_gid=tnvLF-BAYpz1WeRxprCBhw&edm=APs17CUBAAAA&ccb=7-5&oh=00_Afu8DMiV2vTCqEaLi6qGWedm2tOyhfIeoDSzcq0mG6A1TQ&oe=699E7938&_nc_sid=10d13b","Nada de esto es discurso. Son años denunciando corrupción, cuidando a Medellín y defendiendo los recursos públicos.

Por eso seguiremos la defensa de Antioquia en el Congreso de la República.

Para señalar a los corruptos, proponer soluciones y hacer leyes útiles.

💙 Vota 111 a la Cámara por el Nuevo Liberalismo.","Camilo Quintero Giraldo","camideambiente","https://www.instagram.com/p/DUgQ5yjjq6K/","11","Perdón, Camilo quintero no trabajo con Daniel quintero?","224","2026-02-08T16:48:20.000Z",
"https://scontent-det1-1.cdninstagram.com/v/t51.2885-15/627241929_18527002249070113_4044620881584710324_n.jpg?stp=dst-jpg_e15_tt6&_nc_ht=scontent-det1-1.cdninstagram.com&_nc_cat=101&_nc_oc=Q6cZ2QFjXAbzzNxW073dfwPWT5v_ojdb8oI-n5rfm65Nnl8Bvh_Ie51wCeVv0igAf6p2sMs&_nc_ohc=QEC58ezZMmgQ7kNvwHuc3yf&_nc_gid=zZmtiJnAo9scWDafdGW3oQ&edm=APs17CUBAAAA&ccb=7-5&oh=00_AfvhzGWE7GfhF8xu88sZ_epdXK24nygWsZt8O32qOkUFkg&oe=699E6712&_nc_sid=10d13b","Roberto es otro de los muchos ciudadanos afectados por el ruido que generan algunos vecinos. Con la Ley contra el Ruido que lideramos no buscamos imponer silencios absolutos, sino promover acuerdos que mejoren la convivencia y hagan de los espacios residenciales lugares más tranquilos y habitables.

Desde el Congreso seguiré defendiendo su implementación, haciendo control a las autoridades y a la Policía; posibilitando la corresponsabilidad entre vecinos.
#camideambiente","Camilo Quintero Giraldo","camideambiente","https://www.instagram.com/p/DUVoL66Cflw/","38","Visítanos, unidad camino del parque. Horrible la bulla de los miradores y el barrio al frente","181","2026-02-04T13:38:22.000Z",
"https://scontent-lga3-2.cdninstagram.com/v/t51.2885-15/626294920_18527163964070113_6178635066126646136_n.jpg?stp=dst-jpg_e15_tt6&_nc_ht=scontent-lga3-2.cdninstagram.com&_nc_cat=101&_nc_oc=Q6cZ2QFLAY4gstnbANZ6ZMlpomZOYNOHnx8RvfDWhe_hV0N87pL5v3C2FG0mzR5WnOHvLEA&_nc_ohc=lLkU19mi_64Q7kNvwE-mWbQ&_nc_gid=eP-OiBXFC0NS3qBf3XkOOg&edm=APs17CUBAAAA&ccb=7-5&oh=00_AfvoQgKNtJ1oklijlDmiTTxtMjZndFmnWexGLITKCLF45w&oe=699E821B&_nc_sid=10d13b","En Envigado, el ruido sí importa.
La ley existe y hay que hacerla cumplir.

Por eso estamos en la calle y por eso quiero llegar al Congreso.
Mira la cara de galán y vota 111 a la Cámara por el Nuevo Liberalismo 💚

#camideambiente #leycontraelruido","Camilo Quintero Giraldo","camideambiente","https://www.instagram.com/p/DUWuOz3icyZ/","0","","-1","2026-02-04T23:51:51.000Z",
"https://scontent-iad3-1.cdninstagram.com/v/t51.2885-15/627636634_18528068641070113_999707945185177522_n.jpg?stp=dst-jpg_e15_fr_p1080x1080_tt6&_nc_ht=scontent-iad3-1.cdninstagram.com&_nc_cat=101&_nc_oc=Q6cZ2QEWPLIWTgmsCRh8Yx3h49GK6tBLQOdjybBY0tlu_qyzDR86teOD4YJIaTQBNC9hg-k&_nc_ohc=isrW1_SFX30Q7kNvwGvjowa&_nc_gid=YJR3cQD4G0xfyCCkvHqtIw&edm=APs17CUBAAAA&ccb=7-5&oh=00_Aft-DeSygm7ylPEFcFy9lLds4i8Cvr2dWq3aAiNTzuCuEg&oe=699E86B4&_nc_sid=10d13b","🌧️ Las lluvias nos están recordando algo: no todo se resuelve después. Pensar bien cómo crecemos, cómo construimos e integrar la naturaleza en nuestras decisiones también es una forma responsable de cuidar a la gente. Hacerlo mejor no es frenar el desarrollo, es evitar que los problemas se repitan y que la gente termine pagando las consecuencias.

Yo quiero llevar esa forma de pensar al Congreso.
Si a ti también te importa cómo hacemos las cosas en Antioquia,
mira la cara de Galán y vota 111 a la Cámara. 🗳️❤️

#camideambiente #medioambiente #lluvias #Antioquia #urabaantioqueño","Camilo Quintero Giraldo","camideambiente","https://www.instagram.com/p/DUbpm_XkkGo/","0","","-1","2026-02-06T21:45:54.000Z",
"https://scontent-ams2-1.cdninstagram.com/v/t51.2885-15/627729575_18529188508070113_3804011566594411145_n.jpg?stp=dst-jpg_e15_tt6&_nc_ht=scontent-ams2-1.cdninstagram.com&_nc_cat=101&_nc_oc=Q6cZ2QGI4L9KEjLUS3785eJcQgipRQN9pJDp8dycEo0LV1j1FLjCx1OW-J7RoLPafFETM3Y&_nc_ohc=GNf3Zer7XZsQ7kNvwE6DJFo&_nc_gid=g_cmdikMbyd-cG42rAvHWQ&edm=APs17CUBAAAA&ccb=7-5&oh=00_AfuLLd8CwF7WxExxjx4Kd4ogNlXTW_E2bNKe01DoU-LGtw&oe=699E657B&_nc_sid=10d13b","Esto no era solo ruido. Era abuso, corrupción y una comunidad pagando las consecuencias.

Cuando la ley se pone del lado de la gente, los negocios montados a las malas se caen. Y cuando la ciudadanía se organiza y no se queda callada, pasan estas cosas.

Así es como se defiende Antioquia: con ley, con comunidad y sin miedo a incomodar al poder. 🤝♥️

#camideambiente #leycontraelruido #antioquia #vota111","Camilo Quintero Giraldo","camideambiente","https://www.instagram.com/p/DUiqKMpDsJ8/","80","¿Pero esa ley si está aplicando? Porque en Medellín eso es fiesta a cualquier hora, especialmente en diciembre, las motos a mil en la madrugada, donde vivo hasta hacen piques y la policía nunca llega y así sucesivamente...","927","2026-02-09T15:07:55.000Z",
"https://scontent-atl3-2.cdninstagram.com/v/t51.2885-15/627242584_3961615044130921_4013008777449795460_n.jpg?stp=dst-jpg_e15_tt6&_nc_ht=scontent-atl3-2.cdninstagram.com&_nc_cat=101&_nc_oc=Q6cZ2QFvVT9guWU_9v_w-TL3vryKtyF_-WTa-u40Ia_OcsJcOSo7a_KWK0XpHFZ5tEcV4dU&_nc_ohc=Us__Z1zRFPYQ7kNvwFKXw7H&_nc_gid=zqmmcERgyYx_5G-nhOVj5A&edm=APs17CUBAAAA&ccb=7-5&oh=00_AfuflTLHzknD2ETyGGaczhyjROsIc7mnbJ5PnpEiiLzNhw&oe=699E74F0&_nc_sid=10d13b","Me confunden, pero no canto. 
Defiendo el agua, los animales y los árboles.

Creo en una política que cuide la vida, Antioquia y la forma en la que convivimos.
Soy Cami de Ambiente y quiero llevar estas causas al Congreso.

Vota 111 por el Nuevo Liberalismo. 💚🌱

#camideambiente #leycontraelruido #bienestaranimal #medioambiente #turismo","Camilo Quintero Giraldo","camideambiente","https://www.instagram.com/p/DUYZb3-Dvi1/","7","Jajajajaa guapote","109","2026-02-05T15:29:15.000Z",
"https://scontent-dfw6-1.cdninstagram.com/v/t51.2885-15/624237475_18525302758070113_2108155783703251603_n.jpg?stp=dst-jpg_e15_tt6&_nc_ht=scontent-dfw6-1.cdninstagram.com&_nc_cat=101&_nc_oc=Q6cZ2QHX_Ir9lPIeSCr63q4F-Cj0JwV0n1O5JQk5RUSG4lH3lxLVs7PtPhVwqM_HMgsh69M&_nc_ohc=BOSrZHuJgKkQ7kNvwF0DNij&_nc_gid=80EEIH3EXuW8uLPRn74yYg&edm=APs17CUBAAAA&ccb=7-5&oh=00_AfteJmE04xSzKTpoYMvcLjlZ6ZJ_tK0Dtcy7H2DVYRyeew&oe=699E6E9C&_nc_sid=10d13b","Una inundación más en Medellín que deja daños materiales y afectaciones graves en la movilidad.

En Medellín necesitamos tomar decisiones entendiendo nuestra realidad climática, no más improvisaciones. 

No necesitamos mar, necesitamos cumplir las leyes que nos ayuden a planear nuestro futuro como la Ley de Ciudades Verdes que @davalho y yo sacamos adelante en el Congreso. 

#camideambiente #Medellín #aguacero","Camilo Quintero Giraldo","camideambiente","https://www.instagram.com/p/DUFF2pQlPHg/","32","Mucho concreto y después el alcalde sale a distorsionar los desastres, Cambiaron la filtración de los arboles y las zonas verdes por la canalización de el concreto y asfalto y no lo proyectaron. LAS CONSTRUCTORAS SE CAGARON EN MEDELLIN.","322","2026-01-29T03:30:24.000Z",
"https://scontent-ord5-1.cdninstagram.com/v/t51.2885-15/625051718_18526806169070113_2978087731950115223_n.jpg?stp=dst-jpg_e15_fr_p1080x1080_tt6&_nc_ht=scontent-ord5-1.cdninstagram.com&_nc_cat=101&_nc_oc=Q6cZ2QFQuRg6VvhrvMSlpbvB48EOGu-rhG1AaBkXij3Cq_ILUV-b-x7Gog7il9MJTQEMElI&_nc_ohc=ED_QbbbHEcMQ7kNvwEUVsgQ&_nc_gid=UnUqh04ynjcOZqvLbfFKwg&edm=APs17CUBAAAA&ccb=7-5&oh=00_AftXJJCjWR7G91_O2740H8XOyuwJXz3STY4F_Qrw21QKdA&oe=699E5D15&_nc_sid=10d13b","Estoy volanteando todos los días contándole a los vecinos sobre nuestra lucha contra el ruido. 
Recuerda que tenemos derecho a vivir tranquilos y a descansar en nuestra ciudad. 

Ya lideré la Ley Contra el Ruido, Ahora voy por la curul para hacerlas cumplir. 

Mira la cara de Galán y vota 111 por el Nuevo Liberalismo ❤️ 
#camideambiente","Camilo Quintero Giraldo","camideambiente","https://www.instagram.com/p/DUUSX6QiFze/","4","Estuviera en granada Antioquia estaba al lado suyo en esta gestión de verdad que si 🙌","130","2026-02-04T01:08:32.000Z",
"https://scontent-lga3-2.cdninstagram.com/v/t51.2885-15/623683941_18525397207070113_6698183793276814835_n.jpg?stp=dst-jpg_e15_fr_p1080x1080_tt6&_nc_ht=scontent-lga3-2.cdninstagram.com&_nc_cat=101&_nc_oc=Q6cZ2QFrU-ELHWcNvEo8TRw7bNEe5tuCFIZcC6AGtBgm9QvoPD96-SKzBmLUJbxksOr5odQ&_nc_ohc=Tjmst13ww2MQ7kNvwHACfp9&_nc_gid=PodZ3tPluvJObTddAxg33A&edm=APs17CUBAAAA&ccb=7-5&oh=00_Afvas3WqlitieUtzmrVgO8neQhMhPlERQ64ROmybwhL1Dw&oe=699E5EF1&_nc_sid=10d13b","Conocimos la nueva aerolínea @tukairlines , una iniciativa de @mauriciofacio_ que le muestra a los turistas lo maravillosa que es Medellín a través de un vuelo de realidad aumentada sobre la ciudad.

Tuk Airlines apuesta por atraer mejores turistas: personas interesadas en conocer la Medellín real, no la versión que a veces se ve en Netflix.

Junto a @davalho , trabajé en el Congreso por la Ley de Turismo Responsable, una iniciativa que busca impulsar proyectos como este, para que el turismo crezca de manera ordenada, genere oportunidades y respete a nuestras comunidades locales.

Si quieres un turismo responsable mira la cara de Galán y vota 111 Nuevo Liberalismo ❤️","Camilo Quintero Giraldo","camideambiente","https://www.instagram.com/p/DUGN5sWjfAN/","99","👏yooooquiero esa experiencia 😮","2803","2026-01-29T14:00:08.000Z",
"https://scontent-iad3-1.cdninstagram.com/v/t51.2885-15/627917817_18526712503070113_1251621790504952202_n.jpg?stp=dst-jpg_e15_tt6&_nc_ht=scontent-iad3-1.cdninstagram.com&_nc_cat=101&_nc_oc=Q6cZ2QGMYMOoFViomh9nKmvdGVfkOVD31ghvFF9gxmFJq12h6Z6Zb6nDRXl7aLteyC8Pe8U&_nc_ohc=pVySQa7O85gQ7kNvwEWc-YM&_nc_gid=wl2lBFNoH8fU5hPIR3eFHg&edm=APs17CUBAAAA&ccb=7-5&oh=00_Afvt0E79drnJs_0KwaZa5Ro3Cyp1mBfWOubIycI0CAgs1A&oe=699E76DE&_nc_sid=10d13b","Como Alejandro, muchas personas sufren todos los días el ruido en sus propios hogares. Un ruido que arrebata la tranquilidad, afecta la salud y termina desplazando a quienes solo quieren vivir en paz.

Con la Ley contra el Ruido no buscamos silencios absolutos; buscamos acuerdos entre vecinos, mejorar la convivencia y construir ciudades más sanas y habitables.

✅ Seguiré defendiendo esta causa en el Congreso, con un compromiso firme con Antioquia y su gente.

#camideambiente #leycontraelruido #medellín  #MedellínColombia","Camilo Quintero Giraldo","camideambiente","https://www.instagram.com/p/DUTb8TjipmM/","44","Venga a barrancabermeja es un caos","267","2026-02-03T17:12:49.000Z",
"https://scontent-dfw5-1.cdninstagram.com/v/t51.2885-15/626405504_18550175551002283_7593683393868938799_n.jpg?stp=dst-jpg_e15_fr_p1080x1080_tt6&_nc_ht=scontent-dfw5-1.cdninstagram.com&_nc_cat=107&_nc_oc=Q6cZ2QGS2ukFog0q_0rg1lltPhWhC9nw9-0xrNASf59hfa0uR_wfEi22cL2AnMDBgSDX7GI&_nc_ohc=RbNTBVlbTj4Q7kNvwGRaLzk&_nc_gid=mgscUelJxtpX3MJsm_VkpQ&edm=APs17CUBAAAA&ccb=7-5&oh=00_AftXJowTSn2qtHXWEFs4ilye-7-dAAz38UKHWIFp3nVh8Q&oe=699E64FB&_nc_sid=10d13b","Creo en @camideambiente, en su compromiso y su capacidad para defender a Antioquia, la naturaleza y su gente. 

Hoy me sumo a esta ruta colectiva que lo llevará a la Cámara de Representantes, para cuidar lo que somos y lo que amamos como departamento.","Daniel Carvalho","davalho","https://www.instagram.com/p/DUTFDMCCjCB/","26","👏👏👏👏👏","320","2026-02-03T13:56:41.000Z",
"https://instagram.fagc1-1.fna.fbcdn.net/v/t51.2885-15/624847629_18525915784070113_63466957058714286_n.jpg?stp=dst-jpg_e15_fr_p1080x1080_tt6&_nc_ht=instagram.fagc1-1.fna.fbcdn.net&_nc_cat=101&_nc_oc=Q6cZ2QHMHd-6gw9tMrAUXIxypW7jLq5g0xHWzLbOOsjfdSyCZ1Y4kiVadrdajvJvWsURZRo&_nc_ohc=fENnojBS7csQ7kNvwG88BSw&_nc_gid=IMF4amSY_MUIV7c6AWxlZA&edm=APs17CUBAAAA&ccb=7-5&oh=00_Afsfoypqf7yGAlkxLn74l4JOEJwNFYjzF7MnceYUOWysGw&oe=699E7A15&_nc_sid=10d13b","El ruido no es un problema menor en nuestras ciudades. Genera conflictos, deteriora los barrios, afecta la salud y expulsa a las personas.

Seguiré defendiendo esta causa y exigiendo el cumplimiento de la #LeyContraElRuido, promoviendo acuerdos que nos permitan construir ciudades más habitables, con menos conflictos y mejor convivencia.

✨Mira la cara de Galán y marca el 111 por el Nuevo Liberalismo✨","Camilo Quintero Giraldo","camideambiente","https://www.instagram.com/p/DUMAc3wAsKX/","2","La venia bendita del poderoso divino jiji","-1","2026-01-31T19:57:51.000Z",
"https://scontent-phl2-1.cdninstagram.com/v/t51.2885-15/624641648_18525820717070113_7551365987443719797_n.jpg?stp=dst-jpg_e15_fr_p1080x1080_tt6&_nc_ht=scontent-phl2-1.cdninstagram.com&_nc_cat=101&_nc_oc=Q6cZ2QG_qhGumGxUsE8LolrrmFQIAjuoYSI8i1UjEW9hZaXbm42peLv3pvRYhjMX6GPnqZU&_nc_ohc=JtJKrEcERPsQ7kNvwEoAIuz&_nc_gid=n7iNHdnSNMPKSlTaayFtCw&edm=APs17CUBAAAA&ccb=7-5&oh=00_AfvPSnzeiYP2wuci8g_5li6Ipshxmx217XEHt7DogyREyg&oe=699E661F&_nc_sid=10d13b","La serenidad es una decisión política: nos permite convivir, disentir y construir desde la diferencia. Como líder de la Ley contra el Ruido, mi motivación con esta normativa ha sido aportarle a nuestro departamento más serenidad, facilitar acuerdos y reducir conflictos.

Esa es una causa que seguiré defendiendo en el Congreso de la República.

Mira la cara de Galán y marca el 111 por el Nuevo Liberalismo.

#Camideambiente #leycontraelruido","Camilo Quintero Giraldo","camideambiente","https://www.instagram.com/p/DUI73Zvjmov/","3","pensar Y sentir antes de responder ❤️","-1","2026-01-30T15:20:12.000Z",
"https://scontent-lga3-2.cdninstagram.com/v/t51.2885-15/624769623_18525114544070113_336324328428200961_n.jpg?stp=dst-jpg_e15_fr_p1080x1080_tt6&_nc_ht=scontent-lga3-2.cdninstagram.com&_nc_cat=101&_nc_oc=Q6cZ2QEr3t6Hv1yTHLP9APIyY-WQCR0uIwGi5odE5S4Zq1xtCc_LapOpSn3QHqUbK_hG6q8&_nc_ohc=NYs6QQMbaSgQ7kNvwHpZFUj&_nc_gid=aDrtrsCpopZaPtsmB8k7eg&edm=APs17CUBAAAA&ccb=7-5&oh=00_Afsri_LXkXD9kD7NIQvqhvflkY_iT4nNqKHC2fQcmAYgZA&oe=699E78B2&_nc_sid=10d13b","La Ley Contra el Ruido no busca imponer silencio absoluto, sino promover acuerdos entre vecinos, reducir conflictos y encontrar puntos de equilibrio que nos permitan vivir en armonía.

Desde el Congreso seguiré trabajando para que esta ley se implemente en Antioquia y para que nuestras ciudades sean más serenas y más habitables.

Mira la cara de Galán y marca 111 por el Nuevo Liberalismo❤️","Camilo Quintero Giraldo","camideambiente","https://www.instagram.com/p/DUDkABGFNIy/","8","Si vas a acabar con ese ruido te doy mi voto 10000 y colocare a mi familia y amigos a votar por ti tambien","151","2026-01-28T13:15:14.000Z",
"https://scontent-atl3-3.cdninstagram.com/v/t51.2885-15/626230605_2111589616275777_1591445290748994022_n.jpg?stp=dst-jpg_e15_tt6&_nc_ht=scontent-atl3-3.cdninstagram.com&_nc_cat=109&_nc_oc=Q6cZ2QGqcnm75Ro4RomMRLduO99jaM8L1gNA7fTtp4ntEy-sgr-VIdZJuX-jVrwVeCVnbVs&_nc_ohc=7Geuk9k2Po8Q7kNvwGi07p7&_nc_gid=5ZwATc-fUb50kcJbQ_8NeQ&edm=APs17CUBAAAA&ccb=7-5&oh=00_AfshkK2bOoqgzZFSXFry4Y5CnuY00v6vOFhoX3SWnn7duA&oe=699E8677&_nc_sid=10d13b","Las causas que defendemos no pueden quedarse solas.

Antioquia, su gente, su naturaleza y su cultura necesitan ser defendidas en el Congreso.

Cuando Antioquia llama, hay que responder: 1️⃣1️⃣1️⃣","Daniel Carvalho","davalho","https://www.instagram.com/p/DUQgY3uitmz/","20","Si no empiezan a obligar a la policía que deben hacer valer la ley y empezar a afectar el bolsillo de los que generan el ruido con las respectivas multas, la lise la seguirán pasando por la galleta","436","2026-02-02T13:59:49.000Z",
"https://scontent-lga3-2.cdninstagram.com/v/t51.2885-15/624724773_18532939369065821_2204140256121702012_n.jpg?stp=dst-jpg_e15_tt6&_nc_ht=scontent-lga3-2.cdninstagram.com&_nc_cat=105&_nc_oc=Q6cZ2QFnc5OE2PM81QpdXL89wXuwcnLX8vj_-XmRzSbhK1y_o29XHmsgr5zOMcjV-Xf8des&_nc_ohc=23Jz9FFjxgAQ7kNvwHygZg7&_nc_gid=fof-g_NKfJ2Dqx46K4AtAg&edm=APs17CUBAAAA&ccb=7-5&oh=00_AfvZcjb1BvyzzOTQPAANuknqP7wHphjRyM75fGscFi36TA&oe=699E8FE7&_nc_sid=10d13b","Conversaciones de ambiente con @camideambiente 🌳🍃","Fundación Atman Yoga","atmanyogacolombia","https://www.instagram.com/p/DUDj2LdDWg0/","0","","39","2026-01-28T13:14:01.000Z",
"https://scontent-lga3-2.cdninstagram.com/v/t51.2885-15/622025239_18524826103070113_7582569474014874003_n.jpg?stp=dst-jpg_e35_p1080x1080_sh0.08_tt6&_nc_ht=scontent-lga3-2.cdninstagram.com&_nc_cat=101&_nc_oc=Q6cZ2QGjnUVL9BA3VqyHnnvB7nKcpQJQ4d_rUDvjEysYHYqCoA6RgQkLgMFIq7B9xoON1SE&_nc_ohc=yWYovHTgi7IQ7kNvwEzGTuT&_nc_gid=JXB_12IGrct-2iH6epMhog&edm=APs17CUBAAAA&ccb=7-5&oh=00_AfvdiifyFxc7MWpSPjbnNspZeYI49xWNzMnRy3b_kYtfOA&oe=699E7CE0&_nc_sid=10d13b","Uno de los principales retos ambientales del Valle de Aburrá es el manejo de los residuos. Este es un tema que me preocupa y que lideraré desde el Congreso de la República para encontrar soluciones.

✅ ¿Qué alternativas tenemos? Mi querido amigo @mauriciofacio_ nos habla de las oportunidades ambientales y económicas que se dan al implementar un esquema que combine cultura ciudadana y aprovechamiento de residuos.

Vamos por una Medellín y una Antioquia más sostenibles. Por eso, mira la cara de Galán y marca 111 – Nuevo Liberalismo ❤️

#camideambiente","Camilo Quintero Giraldo","camideambiente","https://www.instagram.com/p/DUBBU-TCPAe/","12","Hay que hacer recolección selectiva, si en La Ceja o en Santo Domingo lo hacen no se puede quedar Medellín atrás. Promover el compostaje en los hogares/unidades residenciales hasta que se vuelva obligatorio y cambiar los incentivos para que @emvarias no haga más plata por tonelada dispuesta sino que sea por material reciclado que se incentive e involucrar a los reccuperadores en la economía formal, apoyar las cooperativas y asociaciones de recicladores para brindarles condiciones dignas","134","2026-01-27T13:34:06.000Z",
"https://instagram.fagc1-1.fna.fbcdn.net/v/t51.2885-15/624206138_1939812863614983_3474827272244797501_n.jpg?stp=dst-jpg_e15_tt6&_nc_ht=instagram.fagc1-1.fna.fbcdn.net&_nc_cat=103&_nc_oc=Q6cZ2QE3lxIJAtTYM7cGYyDaBLmaU8If8REzFqq1sLeP-bWZ_FZkdH4IGTbOKO5QuZTVbe0&_nc_ohc=t2DVPamzzMwQ7kNvwHbJHdC&_nc_gid=qY8imAPUjTEtXGfJ1zR4mA&edm=APs17CUBAAAA&ccb=7-5&oh=00_AfvweZ3COghP8Rn49ab8xO2jOEeASyKNTslU1BZrseqNzQ&oe=699E9000&_nc_sid=10d13b","🚨El río Medellín se desbordó mientras Fico habla de construir un mar.

Esto puso en riesgo la vida de miles de personas y colapsó la movilidad de la ciudad.

Medellín no necesita proyectos distractores. Necesita invertir en cuidar sus quebradas, su río y aplicar soluciones basadas en la naturaleza, fortaleciendo la infraestructura para que las inundaciones no se repitan con cada aguacero.

Eso fue lo que propusimos con la Ley de Ciudades Verdes, junto a @davalho.

Hoy Medellín no necesita un mar: necesita cumplir la Ley y proteger sus quebradas, su territorio y su gente.

#Camideambiente #aguacero #Medellín","Camilo Quintero Giraldo","camideambiente","https://www.instagram.com/p/DUEkrEBiWY4/","68","Usted lo que necesita es una clase de Hidrología","1318","2026-01-28T22:41:46.000Z",
"https://scontent-bos5-1.cdninstagram.com/v/t51.2885-15/628603684_1420890016436981_9029474013760975112_n.jpg?stp=dst-jpg_e15_tt6&_nc_ht=scontent-bos5-1.cdninstagram.com&_nc_cat=105&_nc_oc=Q6cZ2QH0pljdmgDDpS6o4wb3AH1EYS5_gbZ8ys3utyCcSjUZHA-dqkX_-BVte620W7WqBkU&_nc_ohc=o7FoXtpY0IsQ7kNvwFDcLvs&_nc_gid=zDrUwiKfLXGzDh0HHiDVWQ&edm=APs17CUBAAAA&ccb=7-5&oh=00_Afsg8HJYn6WRGBtNb_-eg88QczVNMTzA7aHMz0Sfwottlg&oe=699E66D6&_nc_sid=10d13b","Nos encanta encontrarnos con personas que vibran con esta idea.
Que entienden que la alegría también se baila sin incomodar al vecino, cerquita al corazón.💙 

Gracias por tus palabras, @lejortiz 🫰🏽✨

Porque pa’ bailar sabroso, no hay que ser ruidoso.

🗳️ Vota 111 a la Cámara por el Nuevo Liberalismo.

 #LeyContraElRuido #Cultura #Tranquilidad #BailarSinRuido #111ALaCámara NuevoLiberalismo Antioquia","Camilo Quintero Giraldo","camideambiente","https://www.instagram.com/p/DUoxCzjjsMz/","1","Hermoso mi @lejortiz 😍 así es con el 111 vamos firmessss!","-1","2026-02-11T23:16:23.000Z",
"https://scontent-hou1-1.cdninstagram.com/v/t51.2885-15/623612171_4331805100370803_4155036208554535581_n.jpg?stp=dst-jpg_e15_tt6&_nc_ht=scontent-hou1-1.cdninstagram.com&_nc_cat=107&_nc_oc=Q6cZ2QF5RqDnIrQF4lwrPBIv7sx9tSiwRvPCvdg8-y-fMYC5AkoGbohd--Gw6_vbY-PiXGs&_nc_ohc=hoincjXvHoQQ7kNvwE0OsGl&_nc_gid=KHt3o7jOMNHaswTIu6HsUw&edm=APs17CUBAAAA&ccb=7-5&oh=00_AfuDtVVQhNkG71CbkfZg8bEwiDsWsP8J02_isE_FB5dqFA&oe=699E7AA5&_nc_sid=10d13b","El ruido no es una molestia menor. Afecta la salud, expulsa a las personas de sus barrios, afecta el patrimonio y rompe la convivencia ciudadana.

En nuestras ciudades se registran más llamadas por ruido que por robos. De hecho, el 70 % de los reportes al 123 están relacionados con ruido y las riñas que este genera.

Soy el líder de la Ley contra el Ruido y la defenderé en el Congreso para garantizar su cumplimiento en Antioquia.
#camideambiente #medellín","Camilo Quintero Giraldo","camideambiente","https://www.instagram.com/p/DUHEzK6kogM/","7","Eduquen a las alcaldías y policías sobre la Ley 2450/25,es terrible como el ruido se va apoderando de una ciudad.Va a llegar un momento en que el silencio....que es el silencio?😮","-1","2026-01-29T21:59:22.000Z",
"https://scontent-hou1-1.cdninstagram.com/v/t51.2885-15/622407915_18524936437070113_7035930316337506300_n.jpg?stp=dst-jpg_e15_fr_p1080x1080_tt6&_nc_ht=scontent-hou1-1.cdninstagram.com&_nc_cat=101&_nc_oc=Q6cZ2QHpQV62QIohGNdV-8Z93yg6WWSAWHNZxGR9NwtVxR0x3i8eAj8U-rVuBrnCFbgaxA8&_nc_ohc=uTeXGwAOvDcQ7kNvwGEUAMP&_nc_gid=aQypWmgR6NOQF5FEq974aw&edm=APs17CUBAAAA&ccb=7-5&oh=00_AfvP8yNHgrfO12y1rTVajVXtcJuExB0KyBWpKhfuQVQBlQ&oe=699E6F01&_nc_sid=10d13b","Uno de los principales retos que tenemos como sociedad es la falta de espacio y tiempo para estar serenos y tranquilos. Por eso, una de mis banderas para llegar al Congreso es promover más estos espacios, en donde se respire la paz y la convivencia que tanto necesitamos en las ciudades. 

Estuve con mi adorada amiga y maestra Cristina de @atmanyogacolombia y compartimos un momento muy especial. ¡Muchas gracias! 💛

Vamos por una Medellín y una Antioquia pacífica, tranquila y serena a través del yoga y la meditación. Por eso, mira la cara de Galán y marca 111 – Nuevo Liberalismo ❤️","Camilo Quintero Giraldo","camideambiente","https://www.instagram.com/p/DUCL7BYiPZl/","6","Me encanta que con tanto esfuerzo en este momento ya se hayan dado a conocer tanto... Yo hace 5 años voy al jardín botánico a tomar las clases de los domingos y me acuerdo que no iba más de 20 personas y ahora creo que van más de 150 o 200 personas cada domingo  gracias atman yoga por todo lo que hacen por  nosotros👏🙏","-1","2026-01-28T00:25:47.000Z",
