"displayUrl","caption","ownerFullName","ownerUsername","url","commentsCount","firstComment","likesCount","timestamp","queryTag"
"https://scontent-atl3-1.cdninstagram.com/v/t51.2885-15/639728377_1244416641094980_2138990078203427745_n.jpg?stp=dst-jpg_e15_tt6&_nc_ht=scontent-atl3-1.cdninstagram.com&_nc_cat=100&_nc_oc=Q6cZ2QHBeFe7i7hycGlb_7UGqk7txqhwgagRHKsuHACwtH1s5itHQRnetqPX9VJDnHaOyWA&_nc_ohc=Ui7W79_cEvQQ7kNvwERvO0v&_nc_gid=jSZHG79hJJBANEXdReDMFQ&edm=APs17CUBAAAA&ccb=7-5&oh=00_AfstvG8SvcNB1WAEpXmp7Nh2VhNSW-e5WfWvGxt-coCiwA&oe=699E8B6D&_nc_sid=10d13b","Queremos mejores turistas para nuestro departamento. 

En Medellín y Antioquia necesitamos un turismo con reglas claras, que respete a la gente y a nuestra naturaleza. No uno que venga a hacer bulla o a aprovecharse de los más vulnerables.

Ya radicamos un proyecto para regular, no para prohibir. Para ordenar las plataformas, proteger a las comunidades y promover un turismo responsable y sostenible que genere oportunidades.

El trabajo ya empezó. Ahora necesitamos sacarlo adelante en el Congreso.

🗳️ Mira la cara de Galán y vota 111 por el Nuevo Liberalismo 💙♥️

#CamideAmbiente #TurismoResponsable #111ALaCámara #Medellín Antioquia NuevoLiberalismo","Camilo Quintero Giraldo","camideambiente","https://www.instagram.com/p/DU-tplODohw/","4","El problema no es usted sino los que lo respaldan","88","2026-02-20T12:34:44.000Z",
"https://scontent-atl3-3.cdninstagram.com/v/t51.2885-15/632524150_2158363454975649_1900748309237445738_n.jpg?stp=dst-jpg_e15_tt6&_nc_ht=scontent-atl3-3.cdninstagram.com&_nc_cat=109&_nc_oc=Q6cZ2QG6dpUlAUDp5MqRUHkHKiA3Db9Iad9Iq2hOlNISuk4xKhmhlM6bu_KMZ083gJNa2JM&_nc_ohc=uDbRs8QpSgQQ7kNvwE_jzg7&_nc_gid=SoAbOKHcgZBn2DDF4L3m-g&edm=APs17CUBAAAA&ccb=7-5&oh=00_AfviFfz-F31m91Z1vjSrRP-4zai4pW5DTtq_u_vlYjWbww&oe=699E7BA3&_nc_sid=10d13b","Junto a @camideambiente recorrimos el centro de Medellín, un lugar que guarda muchos de los grandes momentos de nuestras vidas y que hoy necesita más atención. 

Desde el Congreso trabajaremos por más seguridad, turismo responsable y una protección real del patrimonio, para que la gente pueda disfrutar el centro sin miedo y con más oferta cultural. 

Vota por el Nuevo Liberalismo - Coalición Ahora Colombia 

Mira la cara de Galán y marca: 
Senado #1
Cámara #111","Juan Sebastián Gómez Gonzales","jua11se","https://www.instagram.com/p/DU4JpwVEbQ8/","7","Mas aprovechao pa onde","386","2026-02-17T23:25:26.000Z",
"https://instagram.flas1-1.fna.fbcdn.net/v/t51.2885-15/626881261_1319047220275826_8293001247178122553_n.jpg?stp=dst-jpg_e15_tt6&_nc_ht=instagram.flas1-1.fna.fbcdn.net&_nc_cat=102&_nc_oc=Q6cZ2QGMh7InT2vi4pUY6OPq7FLHgYjrazjfyMJrZWP8ENHi7R3oW7zybR9Z3UeLy3qoK5w&_nc_ohc=YmC3ZsDLtmoQ7kNvwE0om3w&_nc_gid=R_Evh8M1vQ5cVK-joPlltg&edm=APs17CUBAAAA&ccb=7-5&oh=00_AftBseQqm2JKgytmPDcGNOIQAMm-doEQGhBTQy0bwZSZDA&oe=699E793C&_nc_sid=10d13b","Cuidar a la gente, los animales y nuestra naturaleza.
Tu voz merece llegar al Congreso.
Mira la cara de Galán y marca 111 a la Cámara
por el Nuevo Liberalismo. ❤️

#Camideambiente","Camilo Quintero Giraldo","camideambiente","https://www.instagram.com/p/DUY9G6vEmXD/","0","","98","2026-02-05T20:39:32.000Z",
